<?xml version="1.0" encoding="UTF-8"?>
<!ELEMENT users (user)+>
<!ELEMENT user (username, password)>
<!ELEMENT username (#PCDATA)>
<!ELEMENT password (#PCDATA)>