<?xml version="1.0" encoding="UTF-8"?>
<!DOCTYPE users SYSTEM "users.dtd" >
<users>
  <user>
    <username>Pilvi</username>
    <password>murmeli</password>
  </user>
  <user>
  	<username>Ville</username>
  	<password>password</password>
  </user>
  <user>
  	<username>Jenni</username>
  	<password>password</password>
  </user>
</users>
